query,tags
A side‑by‑side performance chart of Hyperliquid vs. Uniswap V3 over the past 6 months.,Comparative & Performance Analysis
Can you analyze the correlation between BTC and ETH price movements over the last 30 days?,Comparative & Performance Analysis
Compare Boundless token to Lombard incoming launch,Comparative & Performance Analysis
Compare Dfinity (ICP) vs Ethereum in smart contract capabilities.,Comparative & Performance Analysis
Compare HYPE with other DEX Projects.,Comparative & Performance Analysis
Compare the tokenomics and product capabilities of Hyperliquid's HYPE token with Asterdex's ASTER token.,Comparative & Performance Analysis
Compare xrp and hbar Future,Comparative & Performance Analysis
How does BNB compare to Ethereum in terms of transaction fees and developer activity?,Comparative & Performance Analysis
Identify today's most trending cryptocurrency tokens,Comparative & Performance Analysis
okay i have another question. give me idea about project likes Celestia. it's DA layer and i think many top companies eventually will launch their own chain and celestia will get benefit from them. what do you think?,Comparative & Performance Analysis
Top projects on sui,Comparative & Performance Analysis
What are the top trending DeFi pools tokens now?,Comparative & Performance Analysis
Which altcoins are outperforming Bitcoin today?,Comparative & Performance Analysis
Which crypto is seeing the fastest growth this week?,Comparative & Performance Analysis
"Can I receive eth, btc and usdt on Mises wallet",Crypto Concepts & How-To
"How can I buy Monad? Which exchanges or DEXs list it (e.g., Uniswap, Raydium, PancakeSwap)?",Crypto Concepts & How-To
How can I deposit funds on Bitget?,Crypto Concepts & How-To
How can I farm or yield farm Solana? What are the steps and rewards?,Crypto Concepts & How-To
How can I register on the Bitget exchange?,Crypto Concepts & How-To
how can i stake on somnia network,Crypto Concepts & How-To
How can I use DeBank to claim or sweep dust tokens from my wallets?,Crypto Concepts & How-To
How can I withdraw funds from Bitget?,Crypto Concepts & How-To
How do I execute a trade with 160 open tokens?,Crypto Concepts & How-To
How do token-curated registries validate truth?,Crypto Concepts & How-To
How to check if my wallet has been compromised,Crypto Concepts & How-To
"KaitoAI yap을 어떻게하면, 잘 모을수 있을까?",Crypto Concepts & How-To
"near have which dex, list all of them and their token",Crypto Concepts & How-To
"Spot PUP in Hypercore and Hyperevm both counts towards Upheaval Points, as well as airdrop  한글로 번역",Crypto Concepts & How-To
What are the key differences between BNB Chain’s tokenomics and Avalanche’s in terms of sustainability and network growth?,Crypto Concepts & How-To
Which market indicators are more reliable for comparing the strength of Bitcoin dominance versus altcoin performance?,Crypto Concepts & How-To
who is @0x_Samir,Default / General Analysis
$hype potential till bullrun,Macro & Narrative Context
How could international regulatory coordination impact the GameFi sector and trigger a chain reaction for Cardano?,Macro & Narrative Context
How might Polygon's cross-chain integration affect the DAO market?,Macro & Narrative Context
Identify extreme fear moments in crypto market for the last 3 days.,Macro & Narrative Context
What’s driving market sentiment this morning?,Macro & Narrative Context
What’s happening with crypto lending platforms today?,Macro & Narrative Context
What’s happening with decentralized identity projects?,Macro & Narrative Context
What’s happening with staking rewards this week?,Macro & Narrative Context
What’s the Bitcoin fear and greed index today?,Macro & Narrative Context
What's the potential of ASTER DEX?,Macro & Narrative Context
What’s trending in crypto Telegram groups today?,Macro & Narrative Context
What’s trending in proof-of-stake debates today?,Macro & Narrative Context
What’s trending on Crypto Twitter right now?,Macro & Narrative Context
What's your suggestion for best altcoins to gain max profit in this cycle altseason?!,Macro & Narrative Context
Which coins have rising search interest today?,Macro & Narrative Context
Which crypto influencers are pushing new tokens?,Macro & Narrative Context
Which crypto is dominating Reddit discussions today?,Macro & Narrative Context
which crypto will likely pump the most in Q4,Macro & Narrative Context
Which exchanges are facing pressure from regulators?,Macro & Narrative Context
Which gaming tokens are trending now?,Macro & Narrative Context
Why do analysts predict that Ethereum may reach a new all‑time high because of market structure?,Macro & Narrative Context
Why is $aster going up?,Macro & Narrative Context
you think penngu can cross 0.05,Macro & Narrative Context
Any token launches or major updates today?,Market Data & Price Discovery
Are ETH gas fees spiking this week?,Market Data & Price Discovery
Explain Linea Price by end of this month,Market Data & Price Discovery
Filter tokens with 100M–1B market cap and >10% 24h gain,Market Data & Price Discovery
Give me the top 10 market cap cryptos..,Market Data & Price Discovery
"How did the risk‑off market environment, driven by macro‑economic shocks like higher interest rates and heightened geopolitical risk, cause the 38 % decline in open interest?",Market Data & Price Discovery
How will Binance's listing of a popular token trading pair draw market attention?,Market Data & Price Discovery
Issuance volume of the MAV token,Market Data & Price Discovery
List the top 10 tokens by 24h volume.,Market Data & Price Discovery
"Looking at Union Build ($U) 0xba5eD44733953d79717F6269357C77718C8Ba5ed chart https://coinmarketcap.com/currencies/union/ , is the pump party over ?",Market Data & Price Discovery
Market liquidity of the PYTH token,Market Data & Price Discovery
"What are the open interest and order book, funding rates for Solana?",Market Data & Price Discovery
What coins are pumping right now?,Market Data & Price Discovery
What does a 20% increase in futures open interest in the derivatives market indicate about hedging activity?,Market Data & Price Discovery
"What is the all-time high (ATH) price of Monad, and is there potential for it to reach it again? If so, by when?",Market Data & Price Discovery
"What is the current market cap, price, and trading volume of Solana? Is it fair-valued based on hype and utility?",Market Data & Price Discovery
"What new altcoin trading pair will Binance list, and what market attention is it expected to draw?",Market Data & Price Discovery
What’s happening in crypto derivatives funding rates?,Market Data & Price Discovery
What’s happening in decentralized exchanges volume?,Market Data & Price Discovery
What’s happening in perpetual futures trading?,Market Data & Price Discovery
What’s happening on Binance today?,Market Data & Price Discovery
What’s happening with Uniswap volume today?,Market Data & Price Discovery
What's the $PROVE been up in the past 7 days?,Market Data & Price Discovery
When is Monad expected to list on major exchanges or platforms?,Market Data & Price Discovery
Where can I get the highest APY on USDC?,Market Data & Price Discovery
Which altcoins are breaking ATH this week?,Market Data & Price Discovery
Which coins are being shorted right now?,Market Data & Price Discovery
Which coins dominate trading on Binance today?,Market Data & Price Discovery
Which crypto got listed on a new exchange today?,Market Data & Price Discovery
Which exchange listings are trending this week?,Market Data & Price Discovery
"Which popular token trading pair is Kraken exchange planning to list, and how might it attract market attention?",Market Data & Price Discovery
Which projects are trending on DEX volume today?,Market Data & Price Discovery
Which tokens are leading perpetual trading?,Market Data & Price Discovery
Why do crypto prices often crash after reaching all-time highs?,Market Data & Price Discovery
"According to the CryptoQuant report, will Dogecoin experience a technical breakout, and what is the significance of the funding rate inversion in the derivatives market?",Meme Coins
Does $PEPE have any honeypot flags on TokenSniffer?,Meme Coins
"How can transformer models process token-specific documentation: understanding BDAG’s mining whitepaper, DOGE’s community guidelines, and Binance Alpha’s OPEN ledger technical specifications?",Meme Coins
How does the price performance of meme coins like Dogecoin (DOGE) or Shiba Inu (SHIB) compare to utility-driven cryptocurrencies like Chainlink (LINK) or Polkadot (DOT)?,Meme Coins
"In designing an AI to detect fake wallets, what behavioral analysis needs to identify bot patterns across BDAG’s mining accounts, DOGE’s hype-driven addresses, and Binance Alpha’s MIRROR airdrop recipients?",Meme Coins
What does the head-and-shoulders pattern on Dogecoin's daily chart suggest about increased volatility and potential capital inflow for Ripple?,Meme Coins
What does the latest data indicate about Dogecoin price retracing to support due to a surge in exchange outflows?,Meme Coins
"What does the latest data show about Dogecoin price volatility, mainly due to the Fed rate decision?",Meme Coins
Which meme coins are dominating Twitter today?,Meme Coins
"Who are the main competitors in the meme-coin ecosystem across major blockchains, and how do Solana-based meme coins differentiate themselves through narrative, community dynamics, and token-mechanic design?",Meme Coins
"What is the core utility or innovation of Monad (e.g., DeFi integration, NFT utility, meme culture leverage)?",NFTs
Which new NFT projects are minting right now?,NFTs
Are ETH whales accumulating today?,On-Chain Analytics & Flows
Are institutions accumulating Bitcoin this week?,On-Chain Analytics & Flows
Are Layer 2 TVL numbers rising today?,On-Chain Analytics & Flows
Are liquid staking protocols gaining TVL this week?,On-Chain Analytics & Flows
"Are there staking, reflections, or airdrop opportunities for holders of Monad?",On-Chain Analytics & Flows
"Can you find James Wynn wallets on Hyperliquid (you can browse it through whatever on-chain data aggregator such as Nansen, Arkham and much more) and please list all his crazy trades and the outcome",On-Chain Analytics & Flows
"Check the following wallets—0x5C50f4B9Bda2045921A659174e0468691BE783fc, 0xe87bb39Ba1Ee039024262fF0Bf8da4dc08126f7C, 0xC19224F6cc399DdDA364fd783d6FE1bec30F302F, 0x20775d3600C3aECAE6B454B59cF0eACAf73A155A, 0xc79Ea6D9f9eC6d1Bd2720dFED9811361dC5b5F95, and 0xE18dAC4f2CfB1CD316792335E22A6B37cF16CD92 for any unclaimed airdrops, tokens, or vesting contracts.",On-Chain Analytics & Flows
Compare Mises wallet with MetaMask wallet,On-Chain Analytics & Flows
"Could the whale accumulation observed on-chain, possibly linked to hashrate changes, act as a catalyst for an accumulation phase?",On-Chain Analytics & Flows
Create a technical summary of Tezos’ on-chain governance.,On-Chain Analytics & Flows
Does the large wallet accumulation observed in on-chain data suggest increased volatility?,On-Chain Analytics & Flows
Does the MACD divergence on the BNB daily chart suggest a catalyst for an accumulation phase due to increased volatility?,On-Chain Analytics & Flows
How are DeFi TVL numbers moving today?,On-Chain Analytics & Flows
How many holders or transactions does Solana have? What’s the daily/monthly active wallet count?,On-Chain Analytics & Flows
Is it true Linea that every month 1B coin will be added in circulation supply?,On-Chain Analytics & Flows
Is there a tool that can consolidate the dust tokens in the listed EVM wallets into a single token?,On-Chain Analytics & Flows
Market supply and demand of the MAV token,On-Chain Analytics & Flows
ok give me all address having more than 1m ETH,On-Chain Analytics & Flows
"What are the detailed tokenomics of Monad, including distribution and incentives?",On-Chain Analytics & Flows
"What are the detailed tokenomics of Solana, including distribution and incentives?",On-Chain Analytics & Flows
What do on-chain whale metrics indicate about market sentiment and the increasing bullishness of investors?,On-Chain Analytics & Flows
What does the on-chain data showing exchange outflows suggest about a potential short-term correction?,On-Chain Analytics & Flows
"What does the recent on-chain monitoring reveal about the increase in staking activity, and could it be linked to the latest Fed rate decision?",On-Chain Analytics & Flows
What’s happening in cross-chain bridges right now?,On-Chain Analytics & Flows
What’s happening in Solana DeFi today?,On-Chain Analytics & Flows
What’s happening with BNB Chain this week?,On-Chain Analytics & Flows
What’s happening with DeFi liquidations this week?,On-Chain Analytics & Flows
What’s trending in on-chain metrics for ETH?,On-Chain Analytics & Flows
Which crypto whales are known for holding large amounts of tokens?,On-Chain Analytics & Flows
"Who are billionaires now crypto and their wallet address use dune, debanks, and others platform",On-Chain Analytics & Flows
"Who are the major backers or influencers of Monad (e.g., whales, KOLs, early supporters)?",On-Chain Analytics & Flows
Who are the top holders of Bnb,On-Chain Analytics & Flows
Will Metamask airdrop to linear holders,On-Chain Analytics & Flows
about sentient project crypto and its a layer 1?,Project & Fundamental Research
Any current institution backing hype project,Project & Fundamental Research
"Are incentives like staking rewards or exclusive features on the mainnet enough to keep users engaged, or will cheaper layer-2 solutions dominate adoption?",Project & Fundamental Research
Are new blockchain testnets going live this week?,Project & Fundamental Research
Are there any details about the number of yappers eligible for the 0g airdrop and the likely allocation for users whose X account is eligible?,Project & Fundamental Research
Are there major token unlocks happening this week?,Project & Fundamental Research
Are there vesting schedules or lockups for creator/investor tokens in Solana to prevent dumps?,Project & Fundamental Research
Can HYPE attract institutional players the way dYdX or GMX did?,Project & Fundamental Research
"Can SocialFi platforms (like Kaito, UXLINK, Loud) really bring the next billion users into crypto?",Project & Fundamental Research
"How active is the community of Monad? What's the size on Discord, Telegram, Twitter/X, or Reddit?",Project & Fundamental Research
"How active is the community of Solana? What’s the size on Discord, Telegram, Twitter/X, or Reddit?",Project & Fundamental Research
"How does Monad perform against competitors in key metrics like holder growth, reflection rates, or community engagement?",Project & Fundamental Research
"How does Solana perform against competitors in key metrics like holder growth, reflection rates, or community engagement?",Project & Fundamental Research
Identify new airdrop opportunities which has low interaction,Project & Fundamental Research
"In what ways does BNB’s tokenomics differ from other exchange tokens like OKB, HT, or CRO?",Project & Fundamental Research
"Is the Monad code open-source? What’s the GitHub activity like (commits, contributors)?",Project & Fundamental Research
Recommend some great altcoin with good utility,Project & Fundamental Research
Summarize key points for the link https://thepaypers.com/crypto-web3-and-cbdc/news/circle-teams-up-with-okx-to-extend-usdc-liquidity-globally and how does it affect USDC token?,Project & Fundamental Research
what do you think about investing in some L1 cryptoproject,Project & Fundamental Research
"What does the CoinMetrics report indicate about Tron’s potential long‑term uptrend, and how does this align with recent institutional adoption trends?",Project & Fundamental Research
What is the go-to-market strategy or adoption plan for Monad?,Project & Fundamental Research
"What is the launch and development roadmap of Monad, and what milestones have been achieved so far (e.g., listings, burns)?",Project & Fundamental Research
What is the likely allocation for X (Twitter) users in the 0G airdrop?,Project & Fundamental Research
"What is the total supply, circulating supply, and token allocation of Monad (e.g., liquidity, marketing, community rewards)?",Project & Fundamental Research
"What recent partnerships has Monad announced, and what impact do they have on its usage and adoption?",Project & Fundamental Research
"What revenue does the Solana ecosystem generate, and how has it grown over the past period?",Project & Fundamental Research
What tools or infrastructure does Incentiv provide to Web3 game developers as part of its partnership with the Blockchain Game Alliance?,Project & Fundamental Research
What’s trending in AI + crypto hybrid projects?,Project & Fundamental Research
Which DeFi protocols are launching new products?,Project & Fundamental Research
Which new partnerships are announced in DeFi?,Project & Fundamental Research
Which project just launched its mainnet?,Project & Fundamental Research
Which projects are bridging to Ethereum this week?,Project & Fundamental Research
Which projects are integrating real-world assets?,Project & Fundamental Research
Which projects just announced airdrops?,Project & Fundamental Research
Who are the creators and key contributors behind Monad? What is their background and experience in blockchain/crypto or online communities?,Project & Fundamental Research
who is backing $ASTER,Project & Fundamental Research
Are there any known issues or exploits in Solana’s contract beyond audits?,Security & Risks
Are there new exploits in DeFi protocols this week?,Security & Risks
"For DeFi lending protocols like Aave, why does the ""collateral factor"" (the percentage of a collateral asset’s value that can be borrowed against) vary drastically between stablecoins and small-cap altcoins, and how does this relate to ""liquidation cascade"" risks during market crashes?",Security & Risks
"Has Monad undergone security audits for its smart contract? If so, by which firms (e.g., Certik, PeckShield)?",Security & Risks
How can AI be used to improve the security of smart contracts?,Security & Risks
"What are the main risks of Monad (e.g., rug pull potential, pump-and-dump volatility, fading hype)?",Security & Risks
"What are the main risks of Solana (e.g., rug pull potential, pump-and-dump volatility, fading hype)?",Security & Risks
What details are known about the cross-chain bridge phishing attack that caused an undisclosed loss?,Security & Risks
Which chains are suffering network outages today?,Security & Risks
Which token got hacked recently?,Security & Risks
Any trading tips for SOL?,Trading & Strategy Design
"Can you analyze the smart‑money movement shown by on‑chain monitoring, possibly linked to whale address activity, and advise how investors should reassess risk exposure to leveraged positions?",Trading & Strategy Design
"Can you mention 5 legendary trade in crypto history. And describe who is the trader, what they traded and what’s the profit in it",Trading & Strategy Design
"can you tell me which token is good right now to open long position as per their analyse, ta and volume",Trading & Strategy Design
"giive me best entry for cardano right now. for future with entry, TP, SL",Trading & Strategy Design
Give me technical analysis for Solana,Trading & Strategy Design
How should I adjust my ETH and SOL portfolio for the next quarter?,Trading & Strategy Design
Is it a good idea to buy and hold $PROVE,Trading & Strategy Design
is it good to long $APT now?,Trading & Strategy Design
"on base chain, which defi platform provide a solid stable yields",Trading & Strategy Design
"price action about $KAITO, long or short",Trading & Strategy Design
should i buy $swtch token at current price?,Trading & Strategy Design
What does the rising wedge breakout on the Ethereum daily chart indicate about continued momentum and potential sector rotation toward Avalanche?,Trading & Strategy Design
"What does the SHS‑Conferences September 2025 Risk Analysis, Regulatory Response and Future Trends paper say about the 38 % drop in average daily open interest and the 53 % decline in fee revenue for leveraged perpetuals?",Trading & Strategy Design
Where can I maximize my yield on wrapped BTC?,Trading & Strategy Design
Which altcoin just broke resistance?,Trading & Strategy Design
Which crypto currently show the strongest investment potential?,Trading & Strategy Design
"Which of the coins GRT, TWT, CAKE, ICE, and ROSE is best for a 10x long position right now?",Trading & Strategy Design
"With the increasing number of layer-2 solutions emerging, will Ethereum remain the central hub of the DeFi ecosystem, or will most activity eventually shift to layer-2 in the long term?",Trading & Strategy Design